<?xml version="1.0" encoding="UTF-8" standalone="yes"?>
<lionengine:featurable xmlns:lionengine="http://lionengine.b3dgs.com/xsd/9" xmlns:xsi="http://www.w3.org/2001/XMLSchema-instance" xsi:schemaLocation="http://lionengine.b3dgs.com/xsd/9 http://lionengine.b3dgs.com/xsd/9/featurable.xsd">
    <lionengine:class>com.b3dgs.lionengine.helper.EntityHelper</lionengine:class>
    <lionengine:features>
        <lionengine:feature>com.b3dgs.lionengine.example.game.selector.Soldier</lionengine:feature>
    </lionengine:features>
    <lionengine:surface image="OrcSoldier.png"/>
    <lionengine:frames horizontal="24" vertical="8" offsetX="8" offsetY="8"/>
    <lionengine:size width="16" height="16"/>
    <lionengine:origin>BOTTOM_LEFT</lionengine:origin>
    <lionengine:layerable layerRefresh="2" layerDisplay="2"/>
    <lionengine:collidable group="0"/>
    <lionengine:pathfindable>
        <lionengine:path category="ground" cost="1" block="false">
            <lionengine:movement>UP</lionengine:movement>
            <lionengine:movement>LEFT</lionengine:movement>
            <lionengine:movement>RIGHT</lionengine:movement>
            <lionengine:movement>DOWN</lionengine:movement>
            <lionengine:movement>DIAGONAL_UP_LEFT</lionengine:movement>
            <lionengine:movement>DIAGONAL_UP_RIGHT</lionengine:movement>
            <lionengine:movement>DIAGONAL_DOWN_LEFT</lionengine:movement>
            <lionengine:movement>DIAGONAL_DOWN_RIGHT</lionengine:movement>
        </lionengine:path>
        <lionengine:path category="waterBorder" block="true"/>
        <lionengine:path category="tree" block="true"/>
        <lionengine:path category="water" block="true"/>
    </lionengine:pathfindable>
</lionengine:featurable>