<?xml version="1.0" encoding="UTF-8" standalone="yes"?>
<lionengine:featurable xmlns:lionengine="http://lionengine.b3dgs.com/xsd/10" xmlns:xsi="http://www.w3.org/2001/XMLSchema-instance" xsi:schemaLocation="http://lionengine.b3dgs.com/xsd/10 http://lionengine.b3dgs.com/xsd/10/game/feature/featurable.xsd">
    <lionengine:class>com.b3dgs.lionengine.helper.EntityHelper</lionengine:class>
    <lionengine:features>
        <lionengine:feature>com.b3dgs.lionengine.example.game.effect.Effect</lionengine:feature>
    </lionengine:features>
    <lionengine:surface image="Explode.png"/>
    <lionengine:frames horizontal="7" vertical="2"/>
    <lionengine:size width="28" height="28"/>
    <lionengine:origin>MIDDLE</lionengine:origin>
    <lionengine:animations>
        <lionengine:animation name="explode" start="1" end="13" speed="0.5" reversed="false" repeat="false"/>
    </lionengine:animations>
</lionengine:featurable>