<?xml version="1.0" encoding="UTF-8" standalone="yes"?>
<lionengine:featurable xmlns:lionengine="http://lionengine.b3dgs.com/xsd/9" xmlns:xsi="http://www.w3.org/2001/XMLSchema-instance" xsi:schemaLocation="http://lionengine.b3dgs.com/xsd/9 http://lionengine.b3dgs.com/xsd/9/featurable.xsd">
    <lionengine:class>com.b3dgs.lionengine.example.game.entity.Entity</lionengine:class>
    <lionengine:surface image="goomba.png"/>
    <lionengine:frames horizontal="3" vertical="1"/>
    <lionengine:size width="16" height="16"/>
    <lionengine:animations>
        <lionengine:animation name="idle" start="1" end="1" speed="0.125" reversed="false" repeat="false"/>
    </lionengine:animations>
    <lionengine:collisions>
        <lionengine:collision name="default" offsetX="0" offsetY="0" width="12" height="15" mirror="false"/>
    </lionengine:collisions>
    <data mass="2.5"/>
</lionengine:featurable>