<?xml version="1.0" encoding="UTF-8" standalone="yes"?>
<lionengine:featurable xmlns:lionengine="http://lionengine.b3dgs.com/xsd/10" xmlns:xsi="http://www.w3.org/2001/XMLSchema-instance" xsi:schemaLocation="http://lionengine.b3dgs.com/xsd/10 http://lionengine.b3dgs.com/xsd/10/game/feature/featurable.xsd">
    <lionengine:class>com.b3dgs.lionengine.game.it.feature.selector.Entity</lionengine:class>
    <lionengine:surface image="Peon.png"/>
    <lionengine:frames horizontal="15" vertical="9" offsetX="8" offsetY="8"/>
    <lionengine:size width="16" height="16"/>
    <lionengine:animations>
        <lionengine:animation name="idle" start="1" end="1" speed="0.125" reversed="false" repeat="false"/>
    </lionengine:animations>
    <lionengine:collisions>
        <lionengine:collision name="body" offsetX="0" offsetY="0" width="16" height="16" mirror="false"/>
    </lionengine:collisions>
    <lionengine:actions>
        <lionengine:actionRef path="MoveOrc.xml"/>
        <lionengine:actionRef path="BuildingStandardOrc.xml">
            <lionengine:actionRef path="BuildFarmOrc.xml"/>
            <lionengine:actionRef path="CancelOrc.xml" cancel="true"/>
        </lionengine:actionRef>
    </lionengine:actions>
    <lionengine:layerable layerRefresh="2" layerDisplay="2"/>
    <lionengine:producible steps="3"/>
    <lionengine:pathfindable>
        <lionengine:path category="ground" cost="1" block="false">
            <lionengine:movement>UP</lionengine:movement>
            <lionengine:movement>LEFT</lionengine:movement>
            <lionengine:movement>RIGHT</lionengine:movement>
            <lionengine:movement>DOWN</lionengine:movement>
            <lionengine:movement>DIAGONAL_UP_LEFT</lionengine:movement>
            <lionengine:movement>DIAGONAL_UP_RIGHT</lionengine:movement>
            <lionengine:movement>DIAGONAL_DOWN_LEFT</lionengine:movement>
            <lionengine:movement>DIAGONAL_DOWN_RIGHT</lionengine:movement>
        </lionengine:path>
        <lionengine:path category="border" block="true"/>
        <lionengine:path category="tree" block="true"/>
        <lionengine:path category="water" block="true"/>
    </lionengine:pathfindable>
</lionengine:featurable>