<?xml version="1.0" encoding="UTF-8" standalone="yes"?>
<lionengine:featurable xmlns:lionengine="http://lionengine.b3dgs.com/xsd/9" xmlns:xsi="http://www.w3.org/2001/XMLSchema-instance" xsi:schemaLocation="http://lionengine.b3dgs.com/xsd/9 http://lionengine.b3dgs.com/xsd/9/featurable.xsd">
    <lionengine:class>com.b3dgs.lionengine.helper.EntityHelper</lionengine:class>
    <lionengine:features>
        <lionengine:feature>com.b3dgs.lionengine.example.game.raster.Dino</lionengine:feature>
    </lionengine:features>
    <lionengine:surface image="Dino.png"/>
    <lionengine:frames horizontal="4" vertical="4"/>
    <lionengine:origin>MIDDLE</lionengine:origin>
    <lionengine:layerable layerRefresh="1" layerDisplay="1"/>
</lionengine:featurable>