<?xml version="1.0" encoding="UTF-8" standalone="yes"?>
<lionengine:featurable xmlns:lionengine="http://lionengine.b3dgs.com/xsd/9" xmlns:xsi="http://www.w3.org/2001/XMLSchema-instance" xsi:schemaLocation="http://lionengine.b3dgs.com/xsd/9 http://lionengine.b3dgs.com/xsd/9/featurable.xsd">
    <lionengine:class>com.b3dgs.lionengine.helper.EntityHelper</lionengine:class>
    <lionengine:features>
        <lionengine:feature>com.b3dgs.lionengine.example.game.state.EntityModel</lionengine:feature>
        <lionengine:feature>com.b3dgs.lionengine.helper.EntityInputController</lionengine:feature>
    </lionengine:features>
    <lionengine:surface image="Hero.png"/>
    <lionengine:frames horizontal="10" vertical="6"/>
    <lionengine:size width="32" height="64"/>
    <lionengine:origin>CENTER_BOTTOM</lionengine:origin>
    <lionengine:animations>
        <lionengine:animation name="idle" start="1" end="4" speed="0.125" reversed="false" repeat="true"/>
        <lionengine:animation name="walk" start="5" end="12" speed="0.125" reversed="false" repeat="true"/>
        <lionengine:animation name="run" start="13" end="19" speed="0.125" reversed="false" repeat="true"/>
        <lionengine:animation name="jump" start="20" end="21" speed="0.125" reversed="false" repeat="false"/>
        <lionengine:animation name="fall" start="22" end="23" speed="0.125" reversed="false" repeat="false"/>
        <lionengine:animation name="crouch" start="24" end="25" speed="0.1" reversed="false" repeat="true"/>
        <lionengine:animation name="uncrouch" start="24" end="25" speed="0.2" reversed="true" repeat="false"/>
        <lionengine:animation name="defend" start="26" end="30" speed="0.125" reversed="false" repeat="true"/>
        <lionengine:animation name="hurt" start="31" end="32" speed="0.125" reversed="false" repeat="false"/>
        <lionengine:animation name="dead" start="33" end="38" speed="0.125" reversed="false" repeat="false"/>
        <lionengine:animation name="attack1" start="39" end="43" speed="0.18" reversed="false" repeat="false"/>
        <lionengine:animation name="attack2" start="44" end="47" speed="0.18" reversed="false" repeat="false"/>
        <lionengine:animation name="attack3" start="48" end="51" speed="0.18" reversed="false" repeat="false"/>
        <lionengine:animation name="attackrun" start="52" end="57" speed="0.18" reversed="false" repeat="false"/>
    </lionengine:animations>
    <lionengine:state>com.b3dgs.lionengine.example.game.state.StateIdle</lionengine:state>
</lionengine:featurable>